{
    "type": "builtin.canvasoptions",
    "name": [
        "./testdata/ebuLegacy.png"
    ],
    "ColorSpace": {"ColorSpace" : "rec709"},
    "frameSize": {
        "w": 3840,
        "h": 2160
    },
    "linewidth": 0,
    "filedepth": 16,
    "gridColumns" : 384,
    "gridRows":216, 
    "backgroundFillColor":"rgb12(1656,1656,1656)" ,
    "lineColor":"#00FF00"
}